### ISSUE TITLE
Kusama Archive node and 0 peers (litep2p)

### ISSUE THREAD

**Issue by rvalle** [paritytech/polkadot-sdk#8874]
### Is there an existing issue?

- [x] I have searched the existing issues

### Experiencing problems? Have you tried our Stack Exchange first?

- [x] This is not a support question.

### Description of bug

We run several Archive nodes to run Polkawatch.

One of our nodes is Stuck at 0 peers, and wont sync. 

We tested with libp2p and without any p2p customization parameters. The node is stuck for more than one day at 0 peers.

We have never experienced this situation before in years, and believe this is a bug.

### Steps to reproduce

Take a Kusama Archive Node (stable2503-5) that fell 700K blocks behind.
Attempt to sync
It wont gain any peers.

**Comment by rvalle** [comment]
Our logs look like this:

![Image](https://github.com/user-attachments/assets/8ef6bbb3-e5ff-45c8-8a99-bd136b5e87df)

Our other archive nodes: Polkadot Archive, People, etc all work normally.

**Comment by rvalle** [comment]
With litep2p we analyse traffic and we see:

Lots of DNS resolutions of boot nodes looking like:

```
10:34:41.778888 IP 10.50.0.15.53644 > dns.google.domain: 11701+ A? kusama-bootnode.turboflakes.io. (48)
10:34:41.778979 IP 10.50.0.15.53427 > dns.google.domain: 19405+ A? kusama-bootnode.turboflakes.io. (48)
10:34:41.779087 IP 10.50.0.15.52271 > dns.google.domain: 9737+ A? kusama-bootnode.turboflakes.io. (48)
10:34:41.779337 IP 10.50.0.15.62956 > dns.google.domain: 55955+ A? boot-kusama.luckyfriday.io. (44)
10:34:42.779469 IP 10.50.0.15.64138 > dns.google.domain: 3478+ A? kusama.boot.rotko.net. (39)
10:34:42.781092 IP 10.50.0.15.60502 > dns.google.domain: 52547+ A? kusama-boot-ng.dwellir.com. (44)
10:34:42.781141 IP 10.50.0.15.62448 > dns.google.domain: 62635+ A? kusama-boot.dwellir.com. (41)
10:34:42.781158 IP 10.50.0.15.58562 > dns.google.domain: 1638+ A? kusama.boot.rotko.net. (39)
10:34:42.781176 IP 10.50.0.15.59286 > dns.google.domain: 10457+ A? kusama.boot.stake.plus. (40)
10:34:42.781192 IP 10.50.0.15.65060 > dns.google.domain: 5202+ A? boot-node.helikon.io. (38)
10:34:42.781206 IP 10.50.0.15.49390 > dns.google.domain: 45754+ A? kusama.bootnodes.polkadotters.com. (51)
10:34:42.781221 IP 10.50.0.15.54431 > dns.google.domain: 31842+ A? kusama-boot-ng.dwellir.com. (44)
10:34:42.781241 IP 10.50.0.15.50719 > dns.google.domain: 3466+ A? kusama-bootnode-0.polkadot.io. (47)
10:34:42.781257 IP 10.50.0.15.63219 > dns.google.domain: 19093+ A? kusama-bootnode-0.polkadot.io. (47)
10:34:42.781273 IP 10.50.0.15.57016 > dns.google.domain: 41506+ A? kusama-boot.dwellir.com. (41)
10:34:42.781293 IP 10.50.0.15.63417 > dns.google.domain: 811+ A? kusama-boot.dwellir.com. (41)
10:34:42.781310 IP 10.50.0.15.64775 > dns.google.domain: 54511+ A? kusama-bootnode-0.polkadot.io. (47)
10:34:42.781328 IP 10.50.0.15.61858 > dns.google.domain: 50952+ A? kusama-bootnode-0.polkadot.io. (47)
10:34:42.781343 IP 10.50.0.15.61100 > dns.google.domain: 58100+ A? kusama.bootnodes.polkadotters.com. (51)
10:34:42.781358 IP 10.50.0.15.57115 > dns.google.domain: 53758+ A? kusama.bootnodes.polkadotters.com. (51)
10:34:42.781375 IP 10.50.0.15.52584 > dns.google.domain: 24831+ A? boot-node.helikon.io. (38)
10:34:42.781391 IP 10.50.0.15.52067 > dns.google.domain: 31353+ A? boot-node.helikon.io. (38)
10:34:44.780005 IP 10.50.0.15.58261 > dns.google.domain: 62702+ A? kusama-bootnode.radiumblock.com. (49)
10:34:44.780164 IP 10.50.0.15.61198 > dns.google.domain: 29248+ A? ksm-bootnode.stakeworld.io. (44)
10:34:44.780230 IP 10.50.0.15.65258 > dns.google.domain: 3654+ A? kusama-bootnode.radiumblock.com. (49)
10:34:44.780392 IP 10.50.0.15.54350 > dns.google.domain: 22704+ A? ksm-bootnode.stakeworld.io. (44)
10:34:44.780611 IP 10.50.0.15.64467 > dns.google.domain: 53165+ A? ksm-bootnode.stakeworld.io. (44)
10:34:44.780684 IP 10.50.0.15.50839 > dns.google.domain: 1312+ A? ksm-bootnode.stakeworld.io. (44)
```

if we capture traffic excluding DNS port 53 and ARP packets:

```
10:37:01.095093 IP 10.50.0.15.37540 > 104.26.9.125.https: Flags [P.], seq 4043126710:4043126740, ack 3151075316, win 501, options [nop,nop,TS val 1288061359 ecr 2109720040], length 30
10:37:01.208635 IP 104.26.9.125.https > 10.50.0.15.37540: Flags [.], ack 30, win 19, options [nop,nop,TS val 2109724963 ecr 1288061359], length 0
10:37:01.208758 IP 10.50.0.15.37540 > 104.26.9.125.https: Flags [P.], seq 30:584, ack 1, win 501, options [nop,nop,TS val 1288061472 ecr 2109724963], length 554
10:37:01.301101 IP 104.26.9.125.https > 10.50.0.15.37540: Flags [.], ack 584, win 19, options [nop,nop,TS val 2109725061 ecr 1288061472], length 0
10:37:06.095499 IP 10.50.0.15.37540 > 104.26.9.125.https: Flags [P.], seq 584:614, ack 1, win 501, options [nop,nop,TS val 1288066359 ecr 2109725061], length 30
10:37:06.193660 IP 104.26.9.125.https > 10.50.0.15.37540: Flags [.], ack 614, win 19, options [nop,nop,TS val 2109729943 ecr 1288066359], length 0
10:37:06.193778 IP 10.50.0.15.37540 > 104.26.9.125.https: Flags [P.], seq 614:1168, ack 1, win 501, options [nop,nop,TS val 1288066457 ecr 2109729943], length 554
10:37:06.307970 IP 104.26.9.125.https > 10.50.0.15.37540: Flags [.], ack 1168, win 19, options [nop,nop,TS val 2109730066 ecr 1288066457], length 0
10:37:11.096423 IP 10.50.0.15.37540 > 104.26.9.125.https: Flags [P.], seq 1168:1198, ack 1, win 501, options [nop,nop,TS val 1288071360 ecr 2109730066], length 30
10:37:11.182842 IP 104.26.9.125.https > 10.50.0.15.37540: Flags [.], ack 1198, win 19, options [nop,nop,TS val 2109734935 ecr 1288071360], length 0
10:37:11.182963 IP 10.50.0.15.37540 > 104.26.9.125.https: Flags [P.], seq 1198:1752, ack 1, win 501, options [nop,nop,TS val 1288071447 ecr 2109734935], length 554
10:37:11.266232 IP 104.26.9.125.https > 10.50.0.15.37540: Flags [.], ack 1752, win 19, options [nop,nop,TS val 2109735026 ecr 1288071447], length 0
10:37:16.097098 IP 10.50.0.15.37540 > 104.26.9.125.https: Flags [P.], seq 1752:1782, ack 1, win 501, options [nop,nop,TS val 1288076361 ecr 2109735026], length 30
10:37:16.175162 IP 104.26.9.125.https > 10.50.0.15.37540: Flags [.], ack 1782, win 19, options [nop,nop,TS val 2109739936 ecr 1288076361], length 0
10:37:16.175282 IP 10.50.0.15.37540 > 104.26.9.125.https: Flags [P.], seq 1782:2336, ack 1, win 501, options [nop,nop,TS val 1288076439 ecr 2109739936], length 554
10:37:16.273842 IP 104.26.9.125.https > 10.50.0.15.37540: Flags [.], ack 2336, win 19, options [nop,nop,TS val 2109740035 ecr 1288076439], length 0
10:37:21.098017 IP 10.50.0.15.37540 > 104.26.9.125.https: Flags [P.], seq 2336:2366, ack 1, win 501, options [nop,nop,TS val 1288081362 ecr 2109740035], length 30
10:37:21.179333 IP 104.26.9.125.https > 10.50.0.15.37540: Flags [.], ack 2366, win 19, options [nop,nop,TS val 2109744938 ecr 1288081362], length 0
10:37:21.179454 IP 10.50.0.15.37540 > 104.26.9.125.https: Flags [P.], seq 2366:2920, ack 1, win 501, options [nop,nop,TS val 1288081443 ecr 2109744938], length 554
10:37:21.256701 IP 104.26.9.125.https > 10.50.0.15.37540: Flags [.], ack 2920, win 19, options [nop,nop,TS val 2109745019 ecr 1288081443], length 0
10:37:26.098551 IP 10.50.0.15.37540 > 104.26.9.125.https: Flags [P.], seq 2920:2950, ack 1, win 501, options [nop,nop,TS val 1288086362 ecr 2109745019], length 30
10:37:26.175372 IP 104.26.9.125.https > 10.50.0.15.37540: Flags [.], ack 2950, win 19, options [nop,nop,TS val 2109749938 ecr 1288086362], length 0
10:37:26.175614 IP 10.50.0.15.37540 > 104.26.9.125.https: Flags [P.], seq 2950:3504, ack 1, win 501, options [nop,nop,TS val 1288086439 ecr 2109749938], length 554
10:37:26.252490 IP 104.26.9.125.https > 10.50.0.15.37540: Flags [.], ack 3504, win 19, options [nop,nop,TS val 2109750015 ecr 1288086439], length 0
10:37:31.099226 IP 10.50.0.15.37540 > 104.26.9.125.https: Flags [P.], seq 3504:3534, ack 1, win 501, options [nop,nop,TS val 1288091363 ecr 2109750015], length 30
10:37:31.176611 IP 104.26.9.125.https > 10.50.0.15.37540: Flags [.], ack 3534, win 19, options [nop,nop,TS val 2109754937 ecr 1288091363], length 0
10:37:31.176733 IP 10.50.0.15.37540 > 104.26.9.125.https: Flags [P.], seq 3534:4088, ack 1, win 501, options [nop,nop,TS val 1288091440 ecr 2109754937], length 554
10:37:31.255260 IP 104.26.9.125.https > 10.50.0.15.37540: Flags [.], ack 4088, win 19, options [nop,nop,TS val 2109755016 ecr 1288091440], length 0
10:37:36.099669 IP 10.50.0.15.37540 > 104.26.9.125.https: Flags [P.], seq 4088:4118, ack 1, win 501, options [nop,nop,TS val 1288096363 ecr 2109755016], length 30
10:37:36.178273 IP 104.26.9.125.https > 10.50.0.15.37540: Flags [.], ack 4118, win 19, options [nop,nop,TS val 2109759940 ecr 1288096363], length 0
10:37:36.178389 IP 10.50.0.15.37540 > 104.26.9.125.https: Flags [P.], seq 4118:4672, ack 1, win 501, options [nop,nop,TS val 1288096442 ecr 2109759940], length 554
10:37:36.265019 IP 104.26.9.125.https > 10.50.0.15.37540: Flags [.], ack 4672, win 19, options [nop,nop,TS val 2109760024 ecr 1288096442], length 0
```

then there is ONLY traffic to a single IP: 104.26.9.125

Which looks very strange to us. 

Something seems to be stuck in the p2p boot procedure, but the process seems stuck at just one connection that would remain there forever.

**Comment by rvalle** [comment]
Sorry, I did not realize that the litep2p had become default stack.

**Switched to libp2p, and got peers directly.** 

So it seems there is something up with litep2p boot process.... 

![Image](https://github.com/user-attachments/assets/c3eef2ae-4fba-457c-a3ea-d2740483caff)

**Comment by rvalle** [comment]
And now... switching back to libp2p and the node got peers too.

**Comment by lexnv** [comment]
Confirmed with @rvalle that the node was initially running litep2p. Later, switching to libp2p resulted in unblocking the process. As a final step, switching back to litep2p resumes syncing as well.

This might be related to some older issues:
- https://github.com/paritytech/polkadot-sdk/issues/8296
